description,roads,lighting,water,garbage,traffic,fire,drainage,rainwater,priority
rainwater harvesting filter system in park area choked needs cleaning,0,0,0,0,0,0,0,1,Low
damaged median strip with exposed iron rods on highway dangerous,1,0,0,0,0,0,0,0,High
all streetlights on ring road segment between km 5 and 8 are dead,0,1,0,0,0,0,0,0,High
contaminated water from nearby industry mixing into municipal supply,0,0,1,0,0,0,0,0,High
fish and meat market waste not being cleared daily extremely smelly,0,0,0,1,0,0,0,0,High
accident black spot at curve on highway needs warning signs and barriers,1,0,0,0,1,0,0,0,High
fire extinguishers in school expired no replacements provided,0,0,0,0,0,1,0,0,Medium
storm drain outfall blocked by construction material causing backup,0,0,0,0,0,0,1,1,High
entire low lying neighbourhood submerged during monsoon every single year,0,0,0,0,0,0,0,1,High
mud road in our area turns into slush during rains impossible to walk,1,0,0,0,0,0,0,1,Medium
electrical junction box on footpath is open and exposed very dangerous,0,1,0,0,0,1,0,0,High
drinking water pipeline passes through sewage contaminated area,0,0,1,0,0,0,1,0,High
hotel throwing food waste into roadside drain causing blockage and smell,0,0,0,1,0,0,1,0,High
heavy vehicles using narrow residential road despite restriction sign,0,0,0,0,1,0,0,0,Medium
wiring short circuit in community prayer hall could cause fire,0,0,0,0,0,1,0,0,High
drainage canal embankment breached flooding agricultural land,0,0,0,0,0,0,1,1,High
continuous waterlogging at bus stop passengers have to wade through,0,0,0,0,0,0,0,1,Medium
bridge over drain has developed cracks vehicles crossing at own risk,1,0,0,0,0,0,1,0,High
mercury lights replaced with LEDs but installation pending wires hanging,0,1,0,0,0,0,0,0,Medium
we get air instead of water from taps pipeline has multiple leaks,0,0,1,0,0,0,0,0,High
used syringes and medical waste found dumped near childrens park,0,0,0,1,0,0,0,0,High
signal free corridor project causing massive traffic disruption for months,0,0,0,0,1,0,0,0,Medium
spontaneous combustion of methane at garbage landfill site hazardous,0,0,0,1,0,1,0,0,High
nullahs choked with solid waste sewage backing up in toilets,0,0,0,1,0,0,1,0,High
rainwater mixed with sewage entering homes through ground floor toilets,0,0,0,0,0,0,1,1,High
road along canal has no railing vehicles falling into canal,1,0,0,0,0,0,0,0,High
solar panels on street light poles damaged not generating power lights off,0,1,0,0,0,0,0,0,Medium
water supply has tiny worms visible when kept in glass jar,0,0,1,0,0,0,0,0,High
green waste from tree trimming left on road for weeks blocking path,0,0,0,1,0,0,0,0,Medium
school bus route has no traffic mirror at blind curve,0,0,0,0,1,0,0,0,High
transformer oil leak near playground potential fire and health hazard,0,1,0,0,0,1,0,0,High
main sewer line collapsed entire colony sewage has no where to go,0,0,0,0,0,0,1,0,High
fields near river flooded destroying crops due to blocked rain drain outlet,0,0,0,0,0,0,0,1,High
pothole filled with water hiding its depth motorcycle rider got injured,1,0,0,0,0,0,0,0,High
overhead wires sagging too low bus rooftop touching them sparking,0,1,0,0,0,1,0,0,High
ground water depleted bore wells going dry need rain water harvesting policy,0,0,1,0,0,0,0,1,Medium
vegetable market waste swept into gutter causing permanent blockage,0,0,0,1,0,0,1,0,Medium
highway without divider causing head on collision accidents frequently,1,0,0,0,1,0,0,0,High
fire station key staff shortage response time affected badly,0,0,0,0,0,1,0,0,Medium
oxidation pond for sewage overflowing into nearby residential area,0,0,0,0,0,0,1,0,High
persistent flooding in basement after every rain ruining stored goods,0,0,0,0,0,0,0,1,High
collapsed retaining wall exposing road foundation to rain erosion,1,0,0,0,0,0,0,1,High
led panel lights on major bridge going on and off erratically,0,1,0,0,0,0,0,0,Low
water distribution valve leaking for weeks creating permanent puddle,0,0,1,0,0,0,0,0,Medium
tannery waste being dumped into river course polluting downstream,0,0,0,1,0,0,0,0,High
unmarked road diversion at night causing wrong way driving incidents,1,0,0,0,1,0,0,0,High
electrical fire risk in slum area due to illegal hooking of power lines,0,1,0,0,0,1,0,0,High
septic tank of public toilet seeping into nearby water well,0,0,1,0,0,0,1,0,High
annual drain desilting not done this year flooding expected during rains,0,0,0,0,0,0,1,1,Medium
uneven road surface after utility trench poorly backfilled,1,0,0,0,0,0,0,0,Medium
exposed cables on light pole junction box electrocution hazard,0,1,0,0,0,0,0,0,High
borewell motor burnt out no water in taps for entire apartment,0,0,1,0,0,0,0,0,High
illegal dumping of debris filling up natural water channel,0,0,0,1,0,0,0,1,High
traffic marshal needed at five road intersection accidents regular,0,0,0,0,1,0,0,0,High
dry vegetation near power substation fire risk during summer,0,0,0,0,0,1,0,0,Medium
open drain running parallel to main road odour affecting shops,0,0,0,0,0,0,1,0,Medium
urban flooding caused by encroachment over natural drainage path,0,0,0,0,0,0,1,1,High
concrete road has expanded and buckled creating dangerous bump,1,0,0,0,0,0,0,0,High
three streetlights in a row not working near ATM kiosk robbery risk,0,1,0,0,0,0,0,0,High
raw water supply pipeline corroded contaminating treated water,0,0,1,0,0,0,0,0,High
tyres and old mattresses dumped near railway track fire hazard,0,0,0,1,0,1,0,0,Medium
no yielding sign at roundabout causing frequent fender benders,0,0,0,0,1,0,0,0,Medium
warehouse storing chemicals has no fire safety clearance certificate,0,0,0,0,0,1,0,0,High
outlet of rainwater culvert blocked by silt massive flooding upstream,0,0,0,0,0,0,1,1,High
water ankle deep on road three days after rain still not drained,0,0,0,0,0,0,0,1,Medium
speed breakers not painted white vehicles cant see them at night,1,1,0,0,0,0,0,0,Medium
junction box sparking near playground during rain dangerous for kids,0,1,0,0,0,1,0,0,High
overhead water tank of colony leaking significant water wastage daily,0,0,1,0,0,0,0,0,Medium
carcass disposal by municipal workers improper attracting vultures and stench,0,0,0,1,0,0,0,0,High
traffic barricades left after event obstructing two lanes of road,0,0,0,0,1,0,0,0,Low
kerosene spill near apartment fire risk if not cleaned immediately,0,0,0,0,0,1,0,0,High
silted up catch basin not trapping debris flowing into main sewer,0,0,0,0,0,0,1,0,Medium
perennial waterlogging at intersection turns road into pond after rain,0,0,0,0,0,0,0,1,High
construction rubble dumped on road side no clearance attempted,0,0,0,1,0,0,0,0,Medium
insufficient lighting near ATM and bank branch security concern,0,1,0,0,0,0,0,0,High
water treatment plant producing water with unacceptable turbidity levels,0,0,1,0,0,0,0,0,High
illegal garbage transfer station operating near apartment emitting odour,0,0,0,1,0,0,0,0,High
uncontrolled intersection needs at minimum a blinker light,0,0,0,0,1,0,0,0,Medium
high tension wire sagging close to building rooftop fire and shock risk,0,1,0,0,0,1,0,0,High
box drain collapsed revealing deep cavity on footpath pedestrians at risk,0,0,0,0,0,0,1,0,High
monsoon water entering transformer room could cause explosion,0,1,0,0,0,1,0,1,High
damaged road surface near toll booth trucks getting stuck daily,1,0,0,0,0,0,0,0,Medium
flickering high mast light at stadium affecting evening sports activities,0,1,0,0,0,0,0,0,Low
mixed sewage and rain water flowing on road foul smell unbearable,0,0,0,0,0,0,1,1,High
bio waste from clinic found openly dumped in public dustbin,0,0,0,1,0,0,0,0,High
broken traffic signal pole lying on road divider hazard for bikers,0,0,0,0,1,0,0,0,High
diesel generator exhaust near bedroom windows causing health issues,0,0,0,0,0,1,0,0,Medium
choked drainage manhole cover overflowing at multiple points in colony,0,0,0,0,0,0,1,0,High
rainwater collected in abandoned building foundation dengue concern,0,0,0,0,0,0,0,1,Medium
the side road we use for market access has completely disintegrated stones showing,1,0,0,0,0,0,0,0,Medium
night patrol impossible due to no street illumination in outskirts area,0,1,0,0,0,0,0,0,High
please check water quality in our bore well children falling sick frequently,0,0,1,0,0,0,0,0,High
massive garbage mound near railway station eyesore for tourists,0,0,0,1,0,0,0,0,Medium
no right turn filter arrow at signal causing delays during non peak hours,0,0,0,0,1,0,0,0,Low
smell of burning plastic coming from garbage processing unit near colony,0,0,0,1,0,1,0,0,Medium
drain behind the temple discharges directly into lake polluting water body,0,0,0,0,0,0,1,0,High
seasonal flooding ruins our shops every year when will permanent fix come,0,0,0,0,0,0,0,1,High
road tar came off during rain exposing concrete base vehicles skidding,1,0,0,0,0,0,0,0,High
hanging electric cables near temple tree could break and fall on people,0,1,0,0,0,1,0,0,High
water pipeline passing under garbage dump contamination likely,0,0,1,1,0,0,0,0,High
daily garbage burning by neighbourhood residents smoke everywhere,0,0,0,1,0,1,0,0,Medium
narrow lane traffic both ways needs to be made one way,0,0,0,0,1,0,0,0,Medium
fire tender could not reach building due to narrow lanes parked vehicles,0,0,0,0,1,1,0,0,High
drain water black and sticky clearly has chemical discharge from factory,0,0,0,0,0,0,1,0,High
ground floor shops flooded with 2 feet rainwater goods damaged heavily,0,0,0,0,0,0,0,1,High
